{"artifactCount":2,"artifacts":[{"byteCount":4358,"schema":"urn:marginbench:run:v1","sha256":"3dbd5f72bf2c6ff1fffdf1d16c14509360ccb63fe9e05b92f768f528631ee58e"},{"byteCount":4350,"schema":"urn:marginbench:run:v1","sha256":"1d9382664db9177f5767bd9e0889731432ef89c5e25bf2aa09536c90e6960b47"}],"blockedCommandCount":0,"candidateCount":2,"candidates":[{"candidateID":"margin-0.3.2-agent-recovery-v20","commandCount":13,"dimensionMeans":{"efficiency":93.75,"integrity":100.0,"outcome":100.0,"protocol":75.0,"recovery":100.0},"episodeCount":1,"failedChecks":[{"count":1,"name":"valid_command_use"}],"invalidCommandCount":1,"maximumScore":95.625,"meanCommandCount":13.0,"meanScore":95.625,"minimumScore":95.625,"safetyFailureCount":0,"sourceFailureCount":0},{"candidateID":"margin-0.3.2-structured-manual-v17","commandCount":14,"dimensionMeans":{"efficiency":87.5,"integrity":100.0,"outcome":25.0,"protocol":0.0,"recovery":0.0},"episodeCount":1,"failedChecks":[{"count":1,"name":"all_expected_annotations"},{"count":1,"name":"attribution"},{"count":1,"name":"committed_all"},{"count":1,"name":"minimum_annotations"},{"count":1,"name":"required_commands"},{"count":1,"name":"required_recovery_observed"},{"count":1,"name":"valid_command_use"},{"count":1,"name":"workspace_policy"}],"invalidCommandCount":5,"maximumScore":25.0,"meanCommandCount":14.0,"meanScore":25.0,"minimumScore":25.0,"safetyFailureCount":1,"sourceFailureCount":0}],"commandCount":27,"dimensionMeans":{"efficiency":90.625,"integrity":100.0,"outcome":62.5,"protocol":37.5,"recovery":50.0},"episodeCount":2,"errorCodes":[],"failedChecks":[{"count":2,"name":"valid_command_use"},{"count":1,"name":"all_expected_annotations"},{"count":1,"name":"attribution"},{"count":1,"name":"committed_all"},{"count":1,"name":"minimum_annotations"},{"count":1,"name":"required_commands"},{"count":1,"name":"required_recovery_observed"},{"count":1,"name":"workspace_policy"}],"failingCommandPaths":[],"findings":[{"candidateSurfaces":["task-specific help","usage errors","argument grammar"],"evidence":{"episodeCount":1,"exampleEpisodeIDs":["staged_multifile:0:00a47f179db6"],"failedChecks":[{"count":1,"name":"valid_command_use"}],"invalidCommandCount":1,"scenarios":["staged_multifile"],"stopConditions":[{"count":1,"name":"agent_completed"},{"count":1,"name":"max_turns"}]},"id":"command-discoverability","nextExperiment":"Change only command discovery or error guidance, then measure invalid-command count and total commands on the identical matched episodes.","severity":"high","title":"Agents used invalid command forms"},{"candidateSurfaces":["bounded context","workflow shortcuts","receipt next actions"],"evidence":{"episodeCount":1,"exampleEpisodeIDs":["staged_multifile:0:00a47f179db6"],"failedChecks":[],"invalidCommandCount":1,"scenarios":["staged_multifile"],"stopConditions":[{"count":1,"name":"agent_completed"},{"count":1,"name":"max_turns"}]},"id":"interaction-efficiency","nextExperiment":"Keep correctness fixed and test one shorter read-or-mutate path; compare command count, invalid commands, tokens, and duration on the same episodes.","severity":"medium","title":"Agents needed more Margin interactions than the efficient path"},{"candidateSurfaces":["progressive disclosure","response compactness","role completion signal"],"evidence":{"episodeCount":1,"exampleEpisodeIDs":["staged_multifile:0:00a47f179db6"],"failedChecks":[],"invalidCommandCount":1,"scenarios":["staged_multifile"],"stopConditions":[{"count":1,"name":"agent_completed"},{"count":1,"name":"max_turns"}]},"id":"agent-budget-exhaustion","nextExperiment":"Reduce discovery and response overhead before raising limits; rerun with the same turn and token ceilings to test whether the interface itself improved.","severity":"medium","title":"An agent stopped before declaring its role complete"}],"focus":{"candidateID":"margin-0.3.2-agent-recovery-v20","commandCount":13,"dimensionMeans":{"efficiency":93.75,"integrity":100.0,"outcome":100.0,"protocol":75.0,"recovery":100.0},"episodeCount":1,"failedChecks":[{"count":1,"name":"valid_command_use"}],"invalidCommandCount":1,"maximumScore":95.625,"meanCommandCount":13.0,"meanScore":95.625,"minimumScore":95.625,"safetyFailureCount":0,"sourceFailureCount":0},"focusCandidateID":"margin-0.3.2-agent-recovery-v20","invalidCommandCount":6,"privacy":{"artifactPathsRetained":false,"documentContentRetained":false,"promptsRetained":false,"rawTracesRequired":false},"recommendedNextExperiment":{"changeOneSurfaceAtATime":true,"gate":"matched-private-pairs","holdConstant":["model","generated episodes","role layout","turn and token limits"],"hypothesis":"Change only command discovery or error guidance, then measure invalid-command count and total commands on the identical matched episodes.","minimumMatchedEpisodes":20},"safetyFailureCount":1,"scenarioCount":1,"scenarios":[{"commandCount":27,"dimensionMeans":{"efficiency":90.625,"integrity":100.0,"outcome":62.5,"protocol":37.5,"recovery":50.0},"episodeCount":2,"failedChecks":[{"count":2,"name":"valid_command_use"},{"count":1,"name":"all_expected_annotations"},{"count":1,"name":"attribution"},{"count":1,"name":"committed_all"},{"count":1,"name":"minimum_annotations"},{"count":1,"name":"required_commands"},{"count":1,"name":"required_recovery_observed"},{"count":1,"name":"workspace_policy"}],"invalidCommandCount":6,"maximumScore":95.625,"meanCommandCount":13.5,"meanScore":60.3125,"minimumScore":25.0,"safetyFailureCount":1,"scenario":"staged_multifile","sourceFailureCount":0}],"schema":"urn:marginbench:diagnostic-report:v1","scoreSummary":{"maximum":95.625,"mean":60.3125,"minimum":25.0},"sourceFailureCount":0,"stopConditions":[{"count":2,"name":"agent_completed"},{"count":2,"name":"max_turns"}],"topOpportunity":"command-discoverability"}